{
  "name": "test-plugin",
  "version": "1.0.0",
  "description": "A test plugin for unit testing",
  "author": {
    "name": "Test Author",
    "email": "test@example.com",
    "url": "https://example.com"
  },
  "homepage": "https://example.com",
  "repository": "https://github.com/test/test-plugin",
  "license": "MIT",
  "keywords": ["test", "example"],
  "commands": [
    "./commands/test-command.md"
  ],
  "agents": [
    "./agents/test-agent.md"
  ]
}
