{
  "name": "test-plugin-hooks",
  "version": "1.0.0",
  "description": "Test plugin with hook scripts",
  "commands": ["./commands/test.md"],
  "hooks": {
    "SessionStart": [
      {
        "hooks": [
          {
            "type": "command",
            "command": "./hooks/session-start.sh"
          }
        ]
      }
    ],
    "PreToolUse": [
      {
        "matcher": "Bash",
        "hooks": [
          {
            "type": "command",
            "command": "hooks/pre-bash.sh arg1 arg2"
          }
        ]
      }
    ]
  }
}
